[
  {
    "seat_id": "S00001",
    "event_id": "E001",
    "section": "A",
    "row": "1",
    "seat_number": "24",
    "price": 45.5,
    "status": "booked",
    "user_id": "U012"
  },
  {
    "seat_id": "S00002",
    "event_id": "E001",
    "section": "A",
    "row": "18",
    "seat_number": "3",
    "price": 51.81,
    "status": "booked",
    "user_id": "U002"
  },
  {
    "seat_id": "S00003",
    "event_id": "E001",
    "section": "B",
    "row": "8",
    "seat_number": "17",
    "price": 52.04,
    "status": "available",
    "user_id": null
  },
  {
    "seat_id": "S00004",
    "event_id": "E001",
    "section": "VIP",
    "row": "8",
    "seat_number": "15",
    "price": 126.79,
    "status": "available",
    "user_id": null
  },
  {
    "seat_id": "S00005",
    "event_id": "E001",
    "section": "A",
    "row": "6",
    "seat_number": "23",
    "price": 48.45,
    "status": "booked",
    "user_id": "U004"
  },
  {
    "seat_id": "S00006",
    "event_id": "E001",
    "section": "C",
    "row": "4",
    "seat_number": "3",
    "price": 47.6,
    "status": "booked",
    "user_id": "U006"
  },
  {
    "seat_id": "S00007",
    "event_id": "E002",
    "section": "C",
    "row": "2",
    "seat_number": "24",
    "price": 49.19,
    "status": "booked",
    "user_id": "U015"
  },
  {
    "seat_id": "S00008",
    "event_id": "E002",
    "section": "VIP",
    "row": "3",
    "seat_number": "18",
    "price": 120.86,
    "status": "available",
    "user_id": null
  },
  {
    "seat_id": "S00009",
    "event_id": "E002",
    "section": "C",
    "row": "19",
    "seat_number": "7",
    "price": 54.09,
    "status": "booked",
    "user_id": "U004"
  },
  {
    "seat_id": "S00010",
    "event_id": "E002",
    "section": "C",
    "row": "3",
    "seat_number": "28",
    "price": 44.66,
    "status": "booked",
    "user_id": "U005"
  },
  {
    "seat_id": "S00011",
    "event_id": "E002",
    "section": "VIP",
    "row": "12",
    "seat_number": "6",
    "price": 122.4,
    "status": "booked",
    "user_id": "U005"
  },
  {
    "seat_id": "S00012",
    "event_id": "E002",
    "section": "A",
    "row": "20",
    "seat_number": "21",
    "price": 43.42,
    "status": "available",
    "user_id": null
  },
  {
    "seat_id": "S00013",
    "event_id": "E003",
    "section": "B",
    "row": "15",
    "seat_number": "13",
    "price": 45.4,
    "status": "available",
    "user_id": null
  },
  {
    "seat_id": "S00014",
    "event_id": "E003",
    "section": "B",
    "row": "11",
    "seat_number": "27",
    "price": 55.37,
    "status": "booked",
    "user_id": "U014"
  },
  {
    "seat_id": "S00015",
    "event_id": "E003",
    "section": "A",
    "row": "11",
    "seat_number": "13",
    "price": 45.35,
    "status": "booked",
    "user_id": "U010"
  },
  {
    "seat_id": "S00016",
    "event_id": "E003",
    "section": "C",
    "row": "7",
    "seat_number": "21",
    "price": 49.98,
    "status": "available",
    "user_id": null
  },
  {
    "seat_id": "S00017",
    "event_id": "E003",
    "section": "VIP",
    "row": "5",
    "seat_number": "9",
    "price": 117.79,
    "status": "available",
    "user_id": null
  },
  {
    "seat_id": "S00018",
    "event_id": "E003",
    "section": "C",
    "row": "19",
    "seat_number": "14",
    "price": 57.96,
    "status": "booked",
    "user_id": "U004"
  },
  {
    "seat_id": "S00019",
    "event_id": "E004",
    "section": "B",
    "row": "17",
    "seat_number": "16",
    "price": 41.82,
    "status": "booked",
    "user_id": "U002"
  },
  {
    "seat_id": "S00020",
    "event_id": "E004",
    "section": "B",
    "row": "6",
    "seat_number": "26",
    "price": 53.61,
    "status": "available",
    "user_id": null
  },
  {
    "seat_id": "S00021",
    "event_id": "E004",
    "section": "VIP",
    "row": "13",
    "seat_number": "20",
    "price": 134.92,
    "status": "available",
    "user_id": null
  },
  {
    "seat_id": "S00022",
    "event_id": "E004",
    "section": "A",
    "row": "4",
    "seat_number": "22",
    "price": 57.7,
    "status": "available",
    "user_id": null
  },
  {
    "seat_id": "S00023",
    "event_id": "E004",
    "section": "C",
    "row": "4",
    "seat_number": "10",
    "price": 48.7,
    "status": "available",
    "user_id": null
  },
  {
    "seat_id": "S00024",
    "event_id": "E004",
    "section": "C",
    "row": "17",
    "seat_number": "25",
    "price": 43.57,
    "status": "available",
    "user_id": null
  },
  {
    "seat_id": "S00025",
    "event_id": "E005",
    "section": "C",
    "row": "17",
    "seat_number": "20",
    "price": 43.98,
    "status": "booked",
    "user_id": "U003"
  },
  {
    "seat_id": "S00026",
    "event_id": "E005",
    "section": "A",
    "row": "20",
    "seat_number": "11",
    "price": 49.77,
    "status": "booked",
    "user_id": "U006"
  },
  {
    "seat_id": "S00027",
    "event_id": "E005",
    "section": "C",
    "row": "8",
    "seat_number": "2",
    "price": 44.82,
    "status": "available",
    "user_id": null
  },
  {
    "seat_id": "S00028",
    "event_id": "E005",
    "section": "A",
    "row": "3",
    "seat_number": "24",
    "price": 49.72,
    "status": "booked",
    "user_id": "U013"
  },
  {
    "seat_id": "S00029",
    "event_id": "E005",
    "section": "B",
    "row": "5",
    "seat_number": "22",
    "price": 49.51,
    "status": "available",
    "user_id": null
  },
  {
    "seat_id": "S00030",
    "event_id": "E005",
    "section": "C",
    "row": "17",
    "seat_number": "28",
    "price": 52.13,
    "status": "available",
    "user_id": null
  },
  {
    "seat_id": "S00031",
    "event_id": "E006",
    "section": "B",
    "row": "10",
    "seat_number": "13",
    "price": 59.9,
    "status": "available",
    "user_id": null
  },
  {
    "seat_id": "S00032",
    "event_id": "E006",
    "section": "VIP",
    "row": "17",
    "seat_number": "15",
    "price": 117.42,
    "status": "booked",
    "user_id": "U006"
  },
  {
    "seat_id": "S00033",
    "event_id": "E006",
    "section": "A",
    "row": "19",
    "seat_number": "18",
    "price": 44.6,
    "status": "booked",
    "user_id": "U002"
  },
  {
    "seat_id": "S00034",
    "event_id": "E006",
    "section": "A",
    "row": "8",
    "seat_number": "3",
    "price": 58.11,
    "status": "available",
    "user_id": null
  },
  {
    "seat_id": "S00035",
    "event_id": "E006",
    "section": "A",
    "row": "17",
    "seat_number": "8",
    "price": 45.57,
    "status": "available",
    "user_id": null
  },
  {
    "seat_id": "S00036",
    "event_id": "E006",
    "section": "B",
    "row": "19",
    "seat_number": "19",
    "price": 49.45,
    "status": "available",
    "user_id": null
  },
  {
    "seat_id": "S00037",
    "event_id": "E007",
    "section": "VIP",
    "row": "7",
    "seat_number": "4",
    "price": 116.94,
    "status": "available",
    "user_id": null
  },
  {
    "seat_id": "S00038",
    "event_id": "E007",
    "section": "VIP",
    "row": "14",
    "seat_number": "15",
    "price": 132.28,
    "status": "booked",
    "user_id": "U011"
  },
  {
    "seat_id": "S00039",
    "event_id": "E007",
    "section": "A",
    "row": "2",
    "seat_number": "13",
    "price": 54.56,
    "status": "available",
    "user_id": null
  },
  {
    "seat_id": "S00040",
    "event_id": "E007",
    "section": "A",
    "row": "8",
    "seat_number": "7",
    "price": 43.8,
    "status": "available",
    "user_id": null
  },
  {
    "seat_id": "S00041",
    "event_id": "E007",
    "section": "VIP",
    "row": "6",
    "seat_number": "9",
    "price": 124.25,
    "status": "available",
    "user_id": null
  },
  {
    "seat_id": "S00042",
    "event_id": "E007",
    "section": "A",
    "row": "15",
    "seat_number": "26",
    "price": 57.23,
    "status": "available",
    "user_id": null
  },
  {
    "seat_id": "S00043",
    "event_id": "E008",
    "section": "A",
    "row": "18",
    "seat_number": "27",
    "price": 40.3,
    "status": "booked",
    "user_id": "U013"
  },
  {
    "seat_id": "S00044",
    "event_id": "E008",
    "section": "B",
    "row": "6",
    "seat_number": "14",
    "price": 49.71,
    "status": "booked",
    "user_id": "U007"
  },
  {
    "seat_id": "S00045",
    "event_id": "E008",
    "section": "A",
    "row": "6",
    "seat_number": "13",
    "price": 40.04,
    "status": "booked",
    "user_id": "U015"
  },
  {
    "seat_id": "S00046",
    "event_id": "E008",
    "section": "VIP",
    "row": "10",
    "seat_number": "14",
    "price": 128.93,
    "status": "available",
    "user_id": null
  },
  {
    "seat_id": "S00047",
    "event_id": "E008",
    "section": "VIP",
    "row": "5",
    "seat_number": "7",
    "price": 120.93,
    "status": "available",
    "user_id": null
  },
  {
    "seat_id": "S00048",
    "event_id": "E008",
    "section": "A",
    "row": "11",
    "seat_number": "2",
    "price": 41.0,
    "status": "available",
    "user_id": null
  },
  {
    "seat_id": "S00049",
    "event_id": "E009",
    "section": "B",
    "row": "2",
    "seat_number": "17",
    "price": 41.6,
    "status": "booked",
    "user_id": "U010"
  },
  {
    "seat_id": "S00050",
    "event_id": "E009",
    "section": "A",
    "row": "8",
    "seat_number": "13",
    "price": 42.4,
    "status": "available",
    "user_id": null
  },
  {
    "seat_id": "S00051",
    "event_id": "E009",
    "section": "B",
    "row": "19",
    "seat_number": "20",
    "price": 40.79,
    "status": "booked",
    "user_id": "U011"
  },
  {
    "seat_id": "S00052",
    "event_id": "E009",
    "section": "C",
    "row": "9",
    "seat_number": "7",
    "price": 53.39,
    "status": "booked",
    "user_id": "U005"
  },
  {
    "seat_id": "S00053",
    "event_id": "E009",
    "section": "VIP",
    "row": "5",
    "seat_number": "22",
    "price": 127.91,
    "status": "available",
    "user_id": null
  },
  {
    "seat_id": "S00054",
    "event_id": "E009",
    "section": "A",
    "row": "1",
    "seat_number": "15",